{
  "id": "7f3c9a1e-4b02-4d7e-9c55-08a1e6f2b913",
  "created_on": "2026-03-12",
  "status": "active",
  "last_active_on": "2026-10-08",
  "counts": {
    "contacts": null,
    "blocks": null,
    "conversations": null,
    "media_objects": 214,
    "media_bytes": 1800000000
  },
  "devices": [
    {
      "id": "d41f0a11-4c2b-4d3e-8f01-6b2c3d4e07ac",
      "platform": "ios",
      "added_on": "2026-03-12",
      "last_seen_on": "2026-10-08",
      "revoked": false,
      "push": "apns+voip",
      "session": "live"
    },
    {
      "id": "9e20aa22-5d33-4f44-8a55-1b2c3d4eb3d1",
      "platform": "web",
      "added_on": "2026-03-20",
      "last_seen_on": "2026-10-08",
      "revoked": false,
      "push": "web",
      "session": "live"
    },
    {
      "id": "51acbb33-6e44-4a55-9b66-2c3d4e5fe48f",
      "platform": "android",
      "added_on": "2026-05-01",
      "last_seen_on": "2026-09-29",
      "revoked": false,
      "push": "unifiedpush",
      "session": "none"
    },
    {
      "id": "2b7ecc44-7f55-4b66-8c77-3d4e5f6091c0",
      "platform": "ios",
      "added_on": "2026-03-12",
      "last_seen_on": "2026-06-02",
      "revoked": true,
      "push": "none",
      "session": "none"
    }
  ],
  "pin_guard": false
}
